ID,Boutique Name,Category,Estimated Item Count,Website,50-Word Description,Logo,Hero Image,Address,Product Images 1,Product Images 2,Product Images 3,Product Images 4,Product Images 5,Product Images 6,Google Reviews
MST_0020,East Coast Ivy Boutique,Clothing Boutique,500-1000,eastcoastivy.com,"East Coast Ivy appears to be a boutique-style online store selling women’s apparel and accessories, organized into collections and seasonal categories. In my browsing view I couldn’t access reliable “About” copy, so I’m describing the storefront structure rather than making claims about ownership or location. If you paste their About text, I’ll rewrite it to a verified 50 words.",https://east-coast-ivy.myshopify.com/cdn/shop/files/Pink_And_Purple_Gradient_Quote_Instagram_Story_YouTube_Banner_400_x_100_px_3.png?v=1680198627&width=500,https://lh3.googleusercontent.com/p/AF1QipMGw1Fx9FR425XTHfuQLDyB9n_Iri-YQ7yaSNWg=s1360-w1360-h1020-rw,"126 Charles St, Boston, MA 02114",https://east-coast-ivy.myshopify.com/cdn/shop/files/2C8A7968-9637-4328-B9A1-DF8A40EFF7C7.jpg?v=1755721427&width=700,https://east-coast-ivy.myshopify.com/cdn/shop/files/FullSizeRender_347522cb-bb61-4882-9556-135a133ee1a2.jpg?v=1764162587&width=700,https://east-coast-ivy.myshopify.com/cdn/shop/files/Screenshot_2025-10-03_at_1.40.34_PM.png?v=1759513247&width=700,https://east-coast-ivy.myshopify.com/cdn/shop/files/Screenshot2025-10-24at1.37.07PM.png?v=1761327433&width=700,https://east-coast-ivy.myshopify.com/cdn/shop/files/Screenshot_2025-11-25_at_12.06.04_PM.png?v=1764091840&width=700,https://east-coast-ivy.myshopify.com/cdn/shop/files/Screenshot2025-10-24at1.08.30PM.png?v=1761325715&width=700,
MST_0021,Erin Hielle,Clothing Boutique,500-1000,https://erinhielle.com,"Erin Hielle is a boutique fashion retailer associated with Nantucket and Wellesley, with a brand message focused on “luxury” coastal style that transitions from beach to everyday. The site sells women’s clothing, swim, shoes, accessories, and bath/body items, plus some extras like treats and a menswear section. It reads as a resort-meets-suburban boutique concept.",https://erinhielle.com/cdn/shop/files/newlogoerinhielle.jpg?crop=center&height=32&v=1730138464&width=32,https://lh3.googleusercontent.com/gps-cs-s/AHVAweriNe6rKFTMn9S3pYNp_AEOw1SZ-G1Xj7xBC94fua5LeYrnHdzUdPabkCtBGSPSOoWB4INMFCJqEgs7TJcC1Jzk7wMZq9EztziXvYzk65c7AoMUNWJpky6aIhl46aSyiIm7jSD_=s1360-w1360-h1020-rw,"37 Central St, Wellesley, MA, 02482",https://erinhielle.com/cdn/shop/files/like-nothing-thong-3-pack-in-basics-budding-pink-honeydew-xss-7794658.webp?v=1771523172&width=533,https://erinhielle.com/cdn/shop/files/like-nothing-thong-3-pack-in-basics-budding-pink-honeydew-xss-6909693.webp?v=1771523172&width=533,https://erinhielle.com/cdn/shop/files/BP370J-A_PINKSTRIPE_A3_1296x_55268ad9-5f79-49fc-a2ae-a5a03285a2ec.webp?v=1771449203&width=533,https://erinhielle.com/cdn/shop/files/BP370J-A_PINKSTRIPE_A1_1296x_cffe7697-fee2-4388-97dd-0b1934dee728.webp?v=1771449204&width=533,https://erinhielle.com/cdn/shop/files/emily-mccarthy-dress-britt-dress-in-pink-carnation-1218823199.webp?v=1771448505&width=533,https://erinhielle.com/cdn/shop/files/emily-mccarthy-dress-britt-dress-in-pink-carnation-1218823200.webp?v=1771448504&width=533,
MST_0022,Fire Opal,Gifts,100-500,https://fire-opal.com,"Fire Opal Company is a retail store and online shop specializing in American handmade goods—jewelry, apparel, housewares, and occasion gifts. The site is notably artist-forward, letting shoppers browse by makers and also inviting artist submissions. That combination suggests a curated marketplace model: a store that champions independent craftspeople and sells distinctive, giftable, well-made products.",https://fire-opal.com/cdn/shop/files/FireOpal-2019-Logo-431-shopify-01_800x401.png?v=1613678856,https://lh3.googleusercontent.com/gps-cs-s/AHVAweoscDOr8OtxkrMkR5_tMM9C-hMGC81MM-vbLicXR-6l3EwcQ_9VKx0t4ZgST3l6YrsaaHL3kU9YEICDirkRbFYY74Bu5SyYV0IyGoi3yx9vWZETr12yqa02SMKvV2ymBBGhPb_-=s1360-w1360-h1020-rw,"320 Harvard St, Brookline, MA, 02446",https://fire-opal.com/cdn/shop/files/FireOpal-2019-Logo-431-shopify-01_800x401.png?v=1613678856,https://fire-opal.com/cdn/shop/files/73d38e87162701cd7eedcec2d0d4a76286637ed526883338da3754c16702d221_600x600.jpg?v=1771796701,https://fire-opal.com/cdn/shop/files/06306cd75176a286d8f285555a0f8d600a14e8c64b364b90db623a89d40423f3_600x600.jpg?v=1771793702,https://fire-opal.com/cdn/shop/files/ef35f467a8ed7379c2216c217b26d34fe3488d030b8776ef33e27e71813e912c_600x600.jpg?v=1771793204,https://fire-opal.com/cdn/shop/files/e7c2d6502733b91cd2366fd27348eaa45ab3879922f52df24c3ac6e97bc2318d_600x600.jpg?v=1771790829,https://fire-opal.com/cdn/shop/files/93fba58a6f8f4ef73eda18dc9614380b8166048d4607d6a744647552ce12e142_600x600.jpg?v=1771790462,
MST_0023,French + Italian,Clothing Boutique,500-1000,https://frenchitalian.com,"French + Italian is a boutique presenting “nonchalant luxury” and clothing “to celebrate life in.” Their site emphasizes frequent designer drops and an edited mix of women’s apparel and accessories. Overall, it reads like a fashion-curation destination: trend-aware but refined, built around discovering special designers and building a wardrobe that feels elevated without being fussy.",https://frenchitalian.com/cdn/shop/files/french_italian_favicon_1b408d6c-7854-467d-a8b9-1e57017cbdd2_32x32.png?v=1684462970,https://frenchitalian.com/cdn/shop/files/FrenchItalian_Marblehead_1290114f-526b-487f-9e63-21ada0eb2eac_2048x.jpg?v=1668572522,"119 Charles Street, Boston, MA, 02114",https://frenchitalian.com/cdn/shop/files/NACKIYE_PRECIOUS_COAT_MARINE_01_300x300.jpg?v=1771616205,https://frenchitalian.com/cdn/shop/files/Nackiye_E-Com_25_11_25_0749_2048x2048_a9f348a1-d9f3-4e22-9f2c-8bda7d3d2948_300x300.jpg?v=1771617169,https://frenchitalian.com/cdn/shop/files/TOTEME_LIGHT_SPRING_TRENCH_POPPY_01_300x300.jpg?v=1771612820,https://frenchitalian.com/cdn/shop/files/TOTEME_ECOM_PS26_SEASONAL_OUTERWEAR_261-WRO0307-FB0490-344_LIGHT_SPRING_TRENCH_POPPY__316_A_300x300.jpg?v=1771612963,https://frenchitalian.com/cdn/shop/files/ACNE_STUDIOS_A90694_JACKET_MID_BLUE_01_300x300.jpg?v=1771611240,https://frenchitalian.com/cdn/shop/files/A90694-AUZ_D_300x300.jpg?v=1771611676,
MST_0024,Glass Ripples,Home Good,100-500,https://glassripples.com/,"Glass Ripples is a Cambridge-area retail shop and online store focused on home goods, gifts, and artist-made design objects. The site features categories like drinkware, dinnerware, candles, stationery, and playful gifts, plus “shop by artist” browsing. It also references workshops, suggesting they combine retail with hands-on experiences or classes tied to glass and craft.",https://glassripples.com/cdn/shop/files/Frame_47_2.png?v=1709072468&width=600,https://lh3.googleusercontent.com/gps-cs-s/AHVAwepBy8GOROQ7od_2Dtfk-8hrp48mBciVAVkCtFSr8CcsZK-nMInNp-L79zKvPJjUqlfzc_k0dhGP_Vz2DcLTihPp7pfA6BOYXrUEYQBDQcv1iWBYiR3H1cBBc2v-FZ-gq6lWPYg=s1360-w1360-h1020-rw,,https://glassripples.com/cdn/shop/files/Frame1662.png?v=1720547551&width=1946,https://glassripples.com/cdn/shop/files/IMG-0675.jpg?v=1771362287&width=533,https://glassripples.com/cdn/shop/files/IMG-0674.jpg?v=1771694165&width=533,https://glassripples.com/cdn/shop/files/IMG-0670.jpg?v=1771442706&width=533,https://glassripples.com/cdn/shop/files/IMG-0669.jpg?v=1771442706&width=533,https://glassripples.com/cdn/shop/files/IMG-0679.jpg?v=1771442757&width=533,
MST_0025,Green Eyed Daisy,Gifts,100-500,https://greeneyeddaisy.com,"Green Eyed Daisy appears to be a multi-location boutique offering women’s fashion and accessories with an emphasis on brand curation. The site includes sections for brands and locations along with standard e-commerce shopping structure, implying an established retailer rather than a small single-collection label. It reads as contemporary boutique shopping: edited assortments, new arrivals, and seasonal merchandising.",https://greeneyeddaisy.com/cdn/shop/files/Daisy-No-Background_32x32.png?v=1614309479,https://lh3.googleusercontent.com/p/AF1QipPuS164vSQD3zFkjm3khfR-breKoMu84layLRMz=s1360-w1360-h1020-rw,"100 Charles Street, Boston, MA, 02114",https://greeneyeddaisy.com/cdn/shop/files/DarlaSweater_Ivory4_{width}x.webp?v=1759952855,https://greeneyeddaisy.com/cdn/shop/files/DarlaSweater_Ivory4_580x.webp?v=1759952855,https://greeneyeddaisy.com/cdn/shop/files/Lori-AnneDress_Ivory1_cbad9ad5-2b3a-4a4d-8efa-ac6a3e8470e5_{width}x.webp?v=1759951039,https://greeneyeddaisy.com/cdn/shop/files/Lori-AnneDress_Ivory1_cbad9ad5-2b3a-4a4d-8efa-ac6a3e8470e5_580x.webp?v=1759951039,https://greeneyeddaisy.com/cdn/shop/files/GeriPant_PraireFloral1_982f06b5-f6c0-4fd9-bb0a-eb48081e636b_{width}x.webp?v=1759950719,https://greeneyeddaisy.com/cdn/shop/files/GeriPant_PraireFloral1_982f06b5-f6c0-4fd9-bb0a-eb48081e636b_580x.webp?v=1759950719,
MST_0026,Greentail Table,Gifts,1000+,https://greentailtable.com,"Greentail Table is a home and tabletop store oriented around entertaining, registry, and elevated everyday living. The site includes registry and wishlist tools plus store information and events/news, pointing to a local retail destination as well as online shopping. Their product focus appears to include kitchen, tabletop, and giftable home items—useful, beautiful pieces chosen for cooking and gathering.",https://greentailtable.com/cdn/shop/files/favicon_ico_32x32.png?v=1618421265,https://lh3.googleusercontent.com/p/AF1QipNOGNrXmsSGeR5uAMW7VFGks3BsqaNWk6GHhlPY=s1360-w1360-h1020-rw,"343 Watertown St, Newton, MA 02458",https://greentailtable.com/cdn/shop/files/Greentail_Logo.clear_background_800x396.png?v=1613151113,https://greentailtable.com/cdn/shop/files/GT_2.13.26-72_854x640.jpg?v=1771343722,https://greentailtable.com/cdn/shop/t/40/assets/bb2019-bee-gtt-white.png?v=40713808092226662861632255684,https://greentailtable.com/cdn/shop/t/40/assets/bbh2025-gtt-black-trans.png?v=54738508226682376761733184453,https://greentailtable.com/cdn/shop/files/B-IMG_58470-2000_854x640.jpg?v=1770042685,https://greentailtable.com/cdn/shop/files/C-IMG_5863-2000_854x640.jpg?v=1770042685,
MST_0027,Isabel Harvey,Gifts,500-1000,https://isabelharvey.com,"Isabel Harvey is an accessories/jewelry brand with a sparkle-forward identity. The site reads like direct-to-consumer retail, with brand storytelling (“inspiration”), press, and standard customer-care pages. Rather than a general boutique, it feels like a label: a focused product universe designed for gifting and occasion dressing—pieces meant to add shine and personality to everyday outfits.",https://isabelharvey.com/cdn/shop/files/IHRGB.jpg?crop=center&height=32&v=1673969650&width=32,https://lh3.googleusercontent.com/gps-cs-s/AHVAwerp886kB-p4FNUGxH3Ni1a7sgQCVcqZ0aDo3KqF3hqcU7CejBNiLsjggpHU5Ccbbz5KKpe3Gi1AOQEFd9XT0TS1G64-dREx8K8OiFGrXYyibAAtv19axOlHyZVuh9RrQBagNSk=s1360-w1360-h1020-rw,"41 Central St, Wellesley, MA, 02482",https://isabelharvey.com/cdn/shop/files/JLV6002_CatalinaXStud_Gold_A_jpg_20x20_crop_center.webp?v=1770833781,https://isabelharvey.com/cdn/shop/files/JLV6002_CatalinaXStud_Gold_A_jpg_298x298_crop_center.webp?v=1770833781,https://isabelharvey.com/cdn/shop/files/Catalina_X_Stud_Mixed_Metal_centered_NEW_jpg_20x20_crop_center.webp?v=1770833780,https://isabelharvey.com/cdn/shop/files/Catalina_X_Stud_Mixed_Metal_centered_NEW_jpg_298x298_crop_center.webp?v=1770833780,https://isabelharvey.com/cdn/shop/files/Screenshot2026-01-27at3.44.46PM_20x20_crop_center.png?v=1769547278,https://isabelharvey.com/cdn/shop/files/Screenshot2026-01-27at3.44.46PM_298x298_crop_center.png?v=1769547278,
MST_0028,Joy Street Life + Home,Gifts,100-500,https://joystreetgifts.com,"Joy Street Life + Home is a gift shop in West Concord, Massachusetts, described as offering gifts people love to give and receive. The site is gift-forward and boutique-like, suggesting a curated mix of home, lifestyle, and seasonal items chosen for charm and usability. It reads as a local destination for thoughtful gifting, with an emphasis on friendly, approachable curation.",https://joystreetgifts.com/wp-content/uploads/2020/09/cropped-logo2-1-32x32.png,https://lh3.googleusercontent.com/gps-cs-s/AHVAweqABS4aKOqT5i9SvisvVotx4CzFr8FcBUq3yZjcSo8A1Smgw8hdGgpUQsYM67d3bZYDURKWKfzwaqfwvyKNdPsNNbvSLRpxvP_0dd9gL4zrSdaCJe3dYuepcCEhUedJnUg2pWPUOg=s1360-w1360-h1020-rw,"49 Commonwealth Ave, Concord, MA, 01742",https://d2j6dbq0eux0bg.cloudfront.net/images/26182236/4802975861.jpg,https://d2j6dbq0eux0bg.cloudfront.net/images/26182236/4670006565.jpg,https://d2j6dbq0eux0bg.cloudfront.net/images/26182236/1619218763.jpg,https://d2j6dbq0eux0bg.cloudfront.net/images/26182236/1706084656.jpg,https://d2j6dbq0eux0bg.cloudfront.net/images/26182236/1619263019.jpg,https://d2j6dbq0eux0bg.cloudfront.net/images/26182236/products/817066503/5596651736.jpg,
MST_0030,KODOMO — South End,Gifts,500-1000,https://www.kodomoboston.com,"Kodomo is a children’s boutique on Charles Street in Boston offering stylish clothes and accessories for babies through tweens. The site mixes apparel with toys/play and some home/gift categories, plus lookbooks and gift guides. It reads like a curated kids lifestyle store—playful but polished—built for parents and gift-givers who want quality, fun, well-chosen items.",https://www.kodomoboston.com/cdn/shop/t/26/assets/favicon-cat.png?v=109630881381699338281606112746,https://cdn.shopify.com/s/files/1/1045/8790/files/RB8PUNAc_grande.jpg?v=1555436244,"579 Tremont St, Boston, MA, 02118",https://www.kodomoboston.com/cdn/shop/files/Blank800x800-2024-05-28T153509.025.png?v=1716924943,https://www.kodomoboston.com/cdn/shop/files/a_a25e7e94-6d53-4f0f-acbf-a28880e77fc8.jpg?v=1769377932,https://www.kodomoboston.com/cdn/shop/files/a_d98a861e-c3ac-44b6-93c5-029970217e47.jpg?v=1764180055,https://www.kodomoboston.com/cdn/shop/files/5c930a6c7900818dcb04e9627c5caa7bec764795b549d4569dd1284d693e1b07.jpg?v=1731794148,https://www.kodomoboston.com/cdn/shop/files/Blank800x800copy39-10.jpg?v=1731689483,https://www.kodomoboston.com/cdn/shop/files/26220163-23-1.jpg?v=1771187558,
MST_0031,Lekker Home,Home Good,1000+,https://lekkerhome.com,"Lekker Home is a modern design retailer and furniture destination, offering contemporary home furnishings and design services. The site highlights brand and designer curation, sustainability messaging, and trade/contract programs, suggesting they serve both individual shoppers and interior design professionals. Overall, it reads as a serious design shop: modern, architectural pieces selected for long-term living, not disposable trends.",https://cdn11.bigcommerce.com/s-kvxianwgwu/product_images/Favicon.png?t=1709830879,https://cdn11.bigcommerce.com/s-kvxianwgwu/images/stencil/original/image-manager/about-us.jpg?t=1709240632,"38 Wareham St, Boston, MA, 02118",https://store-kvxianwgwu.mybigcommerce.com/product_images/uploaded_images/homepage-nevachair.jpg,https://store-kvxianwgwu.mybigcommerce.com/product_images/uploaded_images/homepage-pk22.jpg,https://store-kvxianwgwu.mybigcommerce.com/product_images/uploaded_images/homepage-series7.jpg,https://store-kvxianwgwu.mybigcommerce.com/product_images/uploaded_images/homepage-taraextendable.jpg,https://store-kvxianwgwu.mybigcommerce.com/product_images/uploaded_images/homepage-designassistance-january-2026.jpg,https://store-kvxianwgwu.mybigcommerce.com/product_images/uploaded_images/homepage-journal-january2026.jpg,
MST_0032,London Harness,Gifts,100-500,https://londonharness.com,"London Harness is a leather goods and gifting retailer with an online shop and a physical presence in Wellesley, Massachusetts. The site’s focus suggests premium accessories—leather goods, luggage, and giftable items—along with personalization and corporate gifting. It reads like a classic specialty store built around craftsmanship, monogram-worthy products, and service-oriented gifting for individuals and businesses.",https://londonharness.com/media/logo/default/lh-logo-w-icon-2203b.png,https://lh3.googleusercontent.com/p/AF1QipOB0krzMEyeYVhNhrQbwARx0Q1ynGfc_i4k498N=s1360-w1360-h1020-rw,"45 Central St, Wellesley, MA, 02482",https://londonharness.com/media/catalog/product/cache/9e875e21332559ea53f436454d141482/rdi/rdi/mz-wallace-metro-convertible-backpack-in-pacific-1283x2383-metro-convertible-bk_1.png,https://londonharness.com/media/catalog/product/cache/9e875e21332559ea53f436454d141482/rdi/rdi/duke-cannon-daily-defense-face-lotion-duke-daily-defense-face-lotio_1.png,https://londonharness.com/media/catalog/product/cache/d953d4f5811cf8ded8b6f0f921aea6fa/rdi/rdi/mz-wallace-passport-organizer-in-silver-stamped-croc-leather-1469n2357-passport-organizer_1.png,https://londonharness.com/media/catalog/product/cache/d953d4f5811cf8ded8b6f0f921aea6fa/rdi/rdi/homesick-snow-day-candle-snow-day_1.png,https://londonharness.com/media/catalog/product/cache/d953d4f5811cf8ded8b6f0f921aea6fa/rdi/rdi/mova-globe-45-mlb-red-sox-with-acrylic-base-mg-45-mlb-bos-red-sox_1.png,https://londonharness.com/media/catalog/product/cache/9e875e21332559ea53f436454d141482/rdi/rdi/mz-wallace-metro-convertible-backpack-in-pacific-1283x2383-metro-convertible-bk_1.png,
MST_0033,Louie International,Clothing Boutique,100-500,https://www.louiestyle.com/,"LOUIE is a specialty retailer with a physical store in South Weymouth, Massachusetts, and an online shop offering an edited assortment of apparel and accessories for lasting style. The site emphasizes categories like outerwear, sportswear, and footwear, plus personal shopping appointments. It reads as a carefully curated store for shoppers who like classic pieces, premium brands, and hands-on service. (Louie)",https://www.louiestyle.com/cdn/shop/files/IMG_5882.jpg?v=1769533402&width=600,https://lh3.googleusercontent.com/gps-cs-s/AHVAweol8iQy2u11t6DAVpWIYJNk-fqt97PMiIr2qwbaN-yhw3B5UwUH9Gg4-oYsOiWNMiHINbtVJhV16LslDrkcctn48Mmqv3lr4zjV1sB0cwg4hD-fnwLlLCtkphIzxTXAx3wlMrnoBA=s1360-w1360-h1020-rw,"318 Harvard St Ste 5, Brookline, MA, 02446",https://www.louiestyle.com/cdn/shop/files/KP2459MA2_AFTNM_F_2048x_ab7113c4-2a12-4af5-ac00-c830883c3d6e.webp?v=1770149141&width=533,https://www.louiestyle.com/cdn/shop/files/KP2428MA2_ALNCM_F_1_1296x_d04de956-c4bd-487e-841d-faa06402775c.webp?v=1769102656&width=533,https://www.louiestyle.com/cdn/shop/files/KG1795MB1_ECRU_F_1728x_2ac67bbf-23e8-4c6d-a2e3-b41fdc3b01f6.webp?v=1769102518&width=533,https://www.louiestyle.com/cdn/shop/files/KP2443MA3_SENSD_F_1512x_b99ed1cb-5647-4e15-8572-3194add194dc.webp?v=1766422613&width=533,https://www.louiestyle.com/cdn/shop/files/KB68401_BLKIV_F_1_2048x_d93ffdff-27c5-44ed-bdc2-7cb5234da0e2.webp?v=1764012380&width=533,https://www.louiestyle.com/cdn/shop/files/KP0513ME4_SLVRB_F_1_1512x_7ece0c59-883b-43d2-9694-b1797cc8cedc.webp?v=1762277611&width=533,
MST_0034,Loveday,Clothing Boutique,100-500,https://lovedaylifestyle.com,"Loveday Lifestyle appears to be a boutique lifestyle shop focused on curated home, gift, and personal items (based on the “lifestyle” framing and typical storefront structure). In my browsing view I couldn’t retrieve reliable About text to confirm location or specialties. If you paste their About copy, I’ll rewrite it into a fully verified 50-word description.",https://lovedaylifestyle.com/cdn/shop/files/Mark-Pacific-Blue-16-Favicon.png?crop=center&height=32&v=1636750986&width=32,https://lh3.googleusercontent.com/p/AF1QipOlX0PCGidC8u35z95eRRDToUdlugI0VEuf7CRO=w408-h320-k-no,"115 Commonwealth Ave, Concord, MA, 01742",https://lovedaylifestyle.com/cdn/shop/files/Loveday-Concord-Shop-Women-Dress-Tallulah-And-Hope-Amber-1.png?v=1764350835&width=533,https://lovedaylifestyle.com/cdn/shop/files/Loveday-Concord-Shop-Women-Dress-Tallulah-And-Hope-Amber-2.png?v=1764350835&width=533,https://lovedaylifestyle.com/cdn/shop/files/Loveday-Concord-Shop-Women-Dress-Tallulah-And-Hope-Harriet-1.png?v=1764350940&width=533,https://lovedaylifestyle.com/cdn/shop/files/Loveday-Concord-Shop-Women-Dress-Tallulah-And-Hope-Harriet-2.png?v=1764350940&width=533,https://lovedaylifestyle.com/cdn/shop/files/Loveday-Concord-Shop-Women-Tallulah-and-Hope-Dress-Pearl-1.png?v=1763059034&width=533,https://lovedaylifestyle.com/cdn/shop/files/Loveday-Concord-Shop-Women-Tallulah-and-Hope-Dress-Pearl-2.png?v=1763059034&width=533,
MST_0035,Magpie Kids,Gifts,1000+,https://magpiekids.com/,"Magpie Kids appears to be a children’s boutique offering kids clothing, toys, and giftable items—structured like a curated shop for families. In my browsing view I couldn’t access definitive About text, so I’m describing the likely retail model suggested by the storefront and name. Share their About paragraph and I’ll produce a verified 50 words.",https://magpiekids.com/i/magpiekids_icon-optimized.svg,https://magpiekids.com/i/storefront.webp,"46 White St, Somerville, MA, 02144",https://magpiekids.com/i/brand-plan_toys.webp,https://magpiekids.com/i/brand-maileg.webp,https://magpiekids.com/i/brand-douglas.webp,https://magpiekids.com/i/brand-djeco.webp,https://magpiekids.com/i/brand-wee_gallery.webp,https://magpiekids.com/i/brand-best_years.webp,
MST_0038,Mint Julep,Clothing Boutique,100-500,https://www.shopmintjulep.com,"Mint Julep appears to be a boutique-style online shop selling women’s apparel and accessories, with seasonal merchandising and category-driven browsing. In my browsing view I couldn’t access a reliable About section to confirm location, founding story, or specialty niche beyond the storefront structure. If you paste their About copy, I’ll write a verified 50-word description.",https://www.shopmintjulep.com/cdn/shop/files/checkout_logo_4_32x32.png?v=1613149065,https://media.timeout.com/images/101657025/750/422/image.jpg,"1302 Beacon St, Brookline, MA, 02446",https://www.shopmintjulep.com/cdn/shop/files/Screenshot2026-02-23at5.18.06PM_{width}x.png?v=1771885161,https://www.shopmintjulep.com/cdn/shop/files/Screenshot2026-02-23at5.18.06PM_1024x.png?v=1771885161,https://www.shopmintjulep.com/cdn/shop/files/Steve_Madden_Ciara_Dress_XQ108797_{width}x.png?v=1771886905,https://www.shopmintjulep.com/cdn/shop/files/Steve_Madden_Ciara_Dress_XQ108797_1024x.png?v=1771886905,https://www.shopmintjulep.com/cdn/shop/files/STEVEMADDEN_APPAREL_XQ108744_PINK-MULTI_01_{width}x.jpg?v=1771889801,https://www.shopmintjulep.com/cdn/shop/files/STEVEMADDEN_APPAREL_XQ108744_PINK-MULTI_01_1024x.jpg?v=1771889801,
MST_0039,Motto,Gifts,100-500,https://mottoharvardsq.com,"Motto Harvard Square appears to be a boutique retail shop located in/associated with Harvard Square, likely emphasizing curated gifts, home goods, and design-forward items (based on naming and typical “Motto” retail concepts). In my browsing view I couldn’t retrieve the About text. Paste it and I’ll convert it into a clean 50-word blurb.",https://mottoharvardsq.com/cdn/shop/files/favicon2022_96x.png?v=1666575683,https://mottoharvardsq.com/cdn/shop/files/image_123650291_8a6dbed3-9b49-4c52-9043-41d424e7d5d5_1800x.jpg?v=1755887799,"26 Church St, Cambridge, MA, 02138",https://mottoharvardsq.com/cdn/shop/files/image_123650291_8da6fb33-a7ed-45b5-b561-840468147e7b_1x1.jpg?v=1755961285,https://mottoharvardsq.com/cdn/shop/files/image_123650291_8da6fb33-a7ed-45b5-b561-840468147e7b_x800.jpg?v=1755961285,https://mottoharvardsq.com/cdn/shop/files/image_123650291_8a6dbed3-9b49-4c52-9043-41d424e7d5d5_{width}x.jpg?v=1755887799,https://mottoharvardsq.com/cdn/shop/files/image_123650291_8a6dbed3-9b49-4c52-9043-41d424e7d5d5_1000x.jpg?v=1755887799,https://mottoharvardsq.com/cdn/shop/files/Mobile-necklaces6.3.24_7f874e25-ee4b-44a1-ab08-bed50f031bdb_1x1.jpg?v=1717464947,https://mottoharvardsq.com/cdn/shop/files/Mobile-necklaces6.3.24_7f874e25-ee4b-44a1-ab08-bed50f031bdb_x800.jpg?v=1717464947,
MST_0040,PATCH NYC,Home Good,500-1000,https://patchnyc.com,"Patch NYC is a design and fragrance-focused brand known for apothecary-style products and home goods (as suggested by their brand framing and common product categories). The site reads like a label with a distinct aesthetic, typically selling perfumes, candles, and curated objects. I couldn’t retrieve their About text in my view; if you paste it, I’ll make it precise.",https://patchnyc.com/cdn/shop/files/Profile_Favicon_Test1_32x32.jpg?v=1695058180,https://patchnyc.com/cdn/shop/files/Monoprix_highlight_1728x.jpg?v=1614297181,"46 Waltham St (Courtyard), Boston, MA, 02118",https://patchnyc.com/cdn/shop/files/Life-on-the-Asteroid1_{width}x.jpg?v=1767904731,https://patchnyc.com/cdn/shop/files/Life-on-the-Asteroid1_720x.jpg?v=1767904731,https://patchnyc.com/cdn/shop/files/Mortal-_-Pestle1_{width}x.jpg?v=1767905213,https://patchnyc.com/cdn/shop/files/Mortal-_-Pestle1_720x.jpg?v=1767905213,https://patchnyc.com/cdn/shop/files/Taking-the-Air1_{width}x.jpg?v=1767904882,https://patchnyc.com/cdn/shop/files/Taking-the-Air1_720x.jpg?v=1767904882,
